PMID,Title,Authors,Citation,First Author,Journal/Book,Publication Year,Create Date,PMCID,NIHMS ID,DOI
"26895493","NMR-based metabonomic analysis of normal rat urine and faeces in response to (±)-venlafaxine treatment","Serrano-Contreras JI, García-Pérez I, Meléndez-Camargo ME, Zepeda-Vallejo LG.","J Pharm Biomed Anal. 2016 May 10;123:82-92. doi: 10.1016/j.jpba.2016.01.044. Epub 2016 Feb 1.","Serrano-Contreras JI","J Pharm Biomed Anal","2016","2016/02/20","","","10.1016/j.jpba.2016.01.044"
"26663782","Norepinephrine Controls Effector T Cell Differentiation through β2-Adrenergic Receptor-Mediated Inhibition of NF-κB and AP-1 in Dendritic Cells","Takenaka MC, Araujo LP, Maricato JT, Nascimento VM, Guereschi MG, Rezende RM, Quintana FJ, Basso AS.","J Immunol. 2016 Jan 15;196(2):637-44. doi: 10.4049/jimmunol.1501206. Epub 2015 Dec 11.","Takenaka MC","J Immunol","2016","2015/12/15","","","10.4049/jimmunol.1501206"
"26620797","Volume-regulated anion channel--a frenemy within the brain","Mongin AA.","Pflugers Arch. 2016 Mar;468(3):421-41. doi: 10.1007/s00424-015-1765-6. Epub 2015 Dec 1.","Mongin AA","Pflugers Arch","2016","2015/12/02","PMC4752865","NIHMS742010","10.1007/s00424-015-1765-6"
"26548358","Amine neurotransmitters, inflammation and epithelial sodium transport","Soares-da-Silva P, Cabral JM, Magalhães D, Fraga S, Magro F.","Exp Physiol. 2016 Apr;101(4):459-64. doi: 10.1113/EP085284. Epub 2015 Dec 14.","Soares-da-Silva P","Exp Physiol","2016","2015/11/10","","","10.1113/EP085284"
"26485293","Combined parental obesity augments single-parent obesity effects on hypothalamus inflammation, leptin signaling (JAK/STAT), hyperphagia, and obesity in the adult mice offspring","Ornellas F, Souza-Mello V, Mandarim-de-Lacerda CA, Aguila MB.","Physiol Behav. 2016 Jan 1;153:47-55. doi: 10.1016/j.physbeh.2015.10.019. Epub 2015 Oct 17.","Ornellas F","Physiol Behav","2016","2015/10/21","","","10.1016/j.physbeh.2015.10.019"
"26225899","Sleep Bruxism in Respiratory Medicine Practice","Mayer P, Heinzer R, Lavigne G.","Chest. 2016 Jan;149(1):262-71. doi: 10.1378/chest.15-0822. Epub 2016 Jan 6.","Mayer P","Chest","2016","2015/07/31","","","10.1378/chest.15-0822"
"27387982","Prostate-specific membrane antigen (PSMA)-mediated laminin proteolysis generates a pro-angiogenic peptide","Conway RE, Rojas C, Alt J, Nováková Z, Richardson SM, Rodrick TC, Fuentes JL, Richardson NH, Attalla J, Stewart S, Fahmy B, Barinka C, Ghosh M, Shapiro LH, Slusher BS.","Angiogenesis. 2016 Oct;19(4):487-500. doi: 10.1007/s10456-016-9521-x. Epub 2016 Jul 8.","Conway RE","Angiogenesis","2016","2016/07/09","","","10.1007/s10456-016-9521-x"
"27907050","When Is the Brain Dead? Living-Like Electrophysiological Responses and Photon Emissions from Applications of Neurotransmitters in Fixed Post-Mortem Human Brains","Rouleau N, Murugan NJ, Tessaro LW, Costa JN, Persinger MA.","PLoS One. 2016 Dec 1;11(12):e0167231. doi: 10.1371/journal.pone.0167231. eCollection 2016.","Rouleau N","PLoS One","2016","2016/12/02","PMC5131983","","10.1371/journal.pone.0167231"
"27783860","Neural Control of the Upper Airway: Respiratory and State-Dependent Mechanisms","Kubin L.","Compr Physiol. 2016 Sep 15;6(4):1801-1850. doi: 10.1002/cphy.c160002.","Kubin L","Compr Physiol","2016","2016/10/27","PMC5242202","NIHMS840493","10.1002/cphy.c160002"
"27757031","Antidepressant effects of curcumin and HU-211 coencapsulated solid lipid nanoparticles against corticosterone-induced cellular and animal models of major depression","He X, Zhu Y, Wang M, Jing G, Zhu R, Wang S.","Int J Nanomedicine. 2016 Oct 3;11:4975-4990. doi: 10.2147/IJN.S109088. eCollection 2016.","He X","Int J Nanomedicine","2016","2016/10/21","PMC5055126","","10.2147/IJN.S109088"
"27624103","Development of a reliable automated screening system to identify small molecules and biologics that promote human β-cell regeneration","Aamodt KI, Aramandla R, Brown JJ, Fiaschi-Taesch N, Wang P, Stewart AF, Brissova M, Powers AC.","Am J Physiol Endocrinol Metab. 2016 Nov 1;311(5):E859-E868. doi: 10.1152/ajpendo.00515.2015. Epub 2016 Sep 13.","Aamodt KI","Am J Physiol Endocrinol Metab","2016","2016/09/15","PMC5130356","","10.1152/ajpendo.00515.2015"
"27489533","Partial Conservation between Mice and Humans in Olfactory Bulb Interneuron Transcription Factor Codes","Fujiwara N, Cave JW.","Front Neurosci. 2016 Jul 20;10:337. doi: 10.3389/fnins.2016.00337. eCollection 2016.","Fujiwara N","Front Neurosci","2016","2016/08/05","PMC4951497","","10.3389/fnins.2016.00337"
"27395044","Involvement of Cholinergic and Adrenergic Receptors in Pathogenesis and Inflammatory Response Induced by Alpha-Neurotoxin Bot III of Scorpion Venom","Nakib I, Martin-Eauclaire MF, Laraba-Djebari F.","Inflammation. 2016 Oct;39(5):1670-80. doi: 10.1007/s10753-016-0401-8.","Nakib I","Inflammation","2016","2016/07/11","","","10.1007/s10753-016-0401-8"
"27379631","Enteric Inhibitory Neurotransmission, Starting Down Under","Sanders KM.","Adv Exp Med Biol. 2016;891:21-9. doi: 10.1007/978-3-319-27592-5_3.","Sanders KM","Adv Exp Med Biol","2016","2016/07/06","","","10.1007/978-3-319-27592-5_3"
"27311541","Succinic semialdehyde dehydrogenase deficiency (SSADHD): Pathophysiological complexity and multifactorial trait associations in a rare monogenic disorder of GABA metabolism","Malaspina P, Roullet JB, Pearl PL, Ainslie GR, Vogel KR, Gibson KM.","Neurochem Int. 2016 Oct;99:72-84. doi: 10.1016/j.neuint.2016.06.009. Epub 2016 Jun 14.","Malaspina P","Neurochem Int","2016","2016/06/18","PMC5028283","NIHMS798204","10.1016/j.neuint.2016.06.009"
"27272503","The Putative SLC Transporters Mfsd5 and Mfsd11 Are Abundantly Expressed in the Mouse Brain and Have a Potential Role in Energy Homeostasis","Perland E, Lekholm E, Eriksson MM, Bagchi S, Arapi V, Fredriksson R.","PLoS One. 2016 Jun 7;11(6):e0156912. doi: 10.1371/journal.pone.0156912. eCollection 2016.","Perland E","PLoS One","2016","2016/06/09","PMC4896477","","10.1371/journal.pone.0156912"
"27216398","Fluorescent oligomer as a chemosensor for the label-free detection of Fe(3+) and dopamine with selectivity and sensitivity","Zhao L, Xin X, Ding P, Song A, Xie Z, Shen J, Xu G.","Anal Chim Acta. 2016 Jul 5;926:99-106. doi: 10.1016/j.aca.2016.04.038. Epub 2016 Apr 28.","Zhao L","Anal Chim Acta","2016","2016/05/25","","","10.1016/j.aca.2016.04.038"
"27207908","Olanzapine Treatment of Adolescent Rats Alters Adult D2 Modulation of Cortical Inputs to the Ventral Striatum","Brooks JM, O'Donnell P, Frost DO.","Int J Neuropsychopharmacol. 2016 Apr 27;19(10):pyw034. doi: 10.1093/ijnp/pyw034.","Brooks JM","Int J Neuropsychopharmacol","2016","2016/05/22","PMC5091821","","10.1093/ijnp/pyw034"
"27194378","A Preliminary Study of DBH (Encoding Dopamine Beta-Hydroxylase) Genetic Variation and Neural Correlates of Emotional and Motivational Processing in Individuals With and Without Pathological Gambling","Yang BZ, Balodis IM, Lacadie CM, Xu J, Potenza MN.","J Behav Addict. 2016 Jun;5(2):282-92. doi: 10.1556/2006.5.2016.026. Epub 2016 May 19.","Yang BZ","J Behav Addict","2016","2016/05/20","PMC5387779","","10.1556/2006.5.2016.026"
"27060483","Gestational stress and fluoxetine treatment differentially affect plasticity, methylation and serotonin levels in the PFC and hippocampus of rat dams","Gemmel M, Rayen I, van Donkelaar E, Loftus T, Steinbusch HW, Kokras N, Dalla C, Pawluski JL.","Neuroscience. 2016 Jul 7;327:32-43. doi: 10.1016/j.neuroscience.2016.03.068. Epub 2016 Apr 11.","Gemmel M","Neuroscience","2016","2016/04/10","","","10.1016/j.neuroscience.2016.03.068"
"27038330","Electron microscopic localization of M2-muscarinic receptors in cholinergic and noncholinergic neurons of the laterodorsal tegmental and pedunculopontine nuclei of the rat mesopontine tegmentum","Garzón M, Pickel VM.","J Comp Neurol. 2016 Oct 15;524(15):3084-103. doi: 10.1002/cne.24010. Epub 2016 Apr 21.","Garzón M","J Comp Neurol","2016","2016/04/03","PMC4981549","NIHMS774346","10.1002/cne.24010"
"27022629","Targeted Deletion of Vesicular GABA Transporter from Retinal Horizontal Cells Eliminates Feedback Modulation of Photoreceptor Calcium Channels","Hirano AA, Liu X, Boulter J, Grove J, Pérez de Sevilla Müller L, Barnes S, Brecha NC.","eNeuro. 2016 Mar 10;3(2):ENEURO.0148-15.2016. doi: 10.1523/ENEURO.0148-15.2016. eCollection 2016 Mar-Apr.","Hirano AA","eNeuro","2016","2016/03/30","PMC4785380","","10.1523/ENEURO.0148-15.2016"
"26602246","The Behavioral Neuroscience of Motivation: An Overview of Concepts, Measures, and Translational Applications","Simpson EH, Balsam PD.","Curr Top Behav Neurosci. 2016;27:1-12. doi: 10.1007/7854_2015_402.","Simpson EH","Curr Top Behav Neurosci","2016","2015/11/26","PMC4864984","NIHMS784543","10.1007/7854_2015_402"
"26499384","Impact of sex differences in brain response to infection with Plasmodium berghei","Dkhil MA, Al-Shaebi EM, Lubbad MY, Al-Quraishy S.","Parasitol Res. 2016 Jan;115(1):415-22. doi: 10.1007/s00436-015-4803-6. Epub 2015 Oct 24.","Dkhil MA","Parasitol Res","2016","2015/10/27","","","10.1007/s00436-015-4803-6"
"25404088","Neuroprotective Effects of β-Asarone Against 6-Hydroxy Dopamine-Induced Parkinsonism via JNK/Bcl-2/Beclin-1 Pathway","Zhang S, Gui XH, Huang LP, Deng MZ, Fang RM, Ke XH, He YP, Li L, Fang YQ.","Mol Neurobiol. 2016 Jan;53(1):83-94. doi: 10.1007/s12035-014-8950-z. Epub 2014 Nov 18.","Zhang S","Mol Neurobiol","2016","2014/11/19","","","10.1007/s12035-014-8950-z"
"27979489","Changes in cholinergic and nitrergic systems of defunctionalized colons after colostomy in rabbits","Moralıoğlu S, Vural İM, Özen İO, Öztürk G, Sarıoğlu Y, Başaklar AC.","J Surg Res. 2017 Jan;207:63-69. doi: 10.1016/j.jss.2016.08.032. Epub 2016 Aug 12.","Moralıoğlu S","J Surg Res","2017","2016/12/17","","","10.1016/j.jss.2016.08.032"
"27966884","Ligand Binding in the Extracellular Vestibule of the Neurotransmitter Transporter Homologue LeuT","Grouleff J, Koldsø H, Miao Y, Schiøtt B.","ACS Chem Neurosci. 2017 Mar 15;8(3):619-628. doi: 10.1021/acschemneuro.6b00359. Epub 2016 Dec 14.","Grouleff J","ACS Chem Neurosci","2017","2016/12/15","","","10.1021/acschemneuro.6b00359"
"27900577","Neuroleptic Drugs and PACAP Differentially Affect the mRNA Expression of Genes Encoding PAC1/VPAC Type Receptors","Jóźwiak-Bębenista M, Kowalczyk E.","Neurochem Res. 2017 Apr;42(4):943-952. doi: 10.1007/s11064-016-2127-2. Epub 2016 Nov 30.","Jóźwiak-Bębenista M","Neurochem Res","2017","2016/12/01","PMC5375968","","10.1007/s11064-016-2127-2"
"27876394","Postnatal irradiation-induced hippocampal neuropathology, cognitive impairment and aging","Tang FR, Loke WK, Khoo BC.","Brain Dev. 2017 Apr;39(4):277-293. doi: 10.1016/j.braindev.2016.11.001. Epub 2016 Nov 19.","Tang FR","Brain Dev","2017","2016/11/24","","","10.1016/j.braindev.2016.11.001"
"27874295","Mechanism of low-level microwave radiation effect on nervous system","Hinrikus H, Bachmann M, Karai D, Lass J.","Electromagn Biol Med. 2017;36(2):202-212. doi: 10.1080/15368378.2016.1251451. Epub 2016 Nov 22.","Hinrikus H","Electromagn Biol Med","2017","2016/11/23","","","10.1080/15368378.2016.1251451"
"27838239","Brain imaging and networks in restless legs syndrome","Rizzo G, Li X, Galantucci S, Filippi M, Cho YW.","Sleep Med. 2017 Mar;31:39-48. doi: 10.1016/j.sleep.2016.07.018. Epub 2016 Aug 29.","Rizzo G","Sleep Med","2017","2016/11/14","PMC5846689","NIHMS946558","10.1016/j.sleep.2016.07.018"
"27826991","Targeted exome sequencing for the identification of a protective variant against Internet gaming disorder at rs2229910 of neurotrophic tyrosine kinase receptor, type 3 (NTRK3): A pilot study","Kim JY, Jeong JE, Rhee JK, Cho H, Chun JW, Kim TM, Choi SW, Choi JS, Kim DJ.","J Behav Addict. 2016 Dec;5(4):631-638. doi: 10.1556/2006.5.2016.077. Epub 2016 Nov 7.","Kim JY","J Behav Addict","2016","2016/11/10","PMC5370368","","10.1556/2006.5.2016.077"
"27702628","Effects of repeated high-dose methamphetamine and ceftriaxone post-treatments on tissue content of dopamine and serotonin as well as glutamate and glutamine","Althobaiti YS, Almalki AH, Das SC, Alshehri FS, Sari Y.","Neurosci Lett. 2016 Nov 10;634:25-31. doi: 10.1016/j.neulet.2016.09.058. Epub 2016 Oct 1.","Althobaiti YS","Neurosci Lett","2016","2016/11/07","","","10.1016/j.neulet.2016.09.058"
"27425420","Interrogating the Molecular Basis for Substrate Recognition in Serotonin and Dopamine Transporters with High-Affinity Substrate-Based Bivalent Ligands","Andersen J, Ladefoged LK, Kristensen TN, Munro L, Grouleff J, Stuhr-Hansen N, Kristensen AS, Schiøtt B, Strømgaard K.","ACS Chem Neurosci. 2016 Oct 19;7(10):1406-1417. doi: 10.1021/acschemneuro.6b00164. Epub 2016 Aug 10.","Andersen J","ACS Chem Neurosci","2016","2016/07/19","","","10.1021/acschemneuro.6b00164"
"27647473","In vitro 6-hydroxydopamine-induced toxicity in striatal, cerebrocortical and hippocampal slices is attenuated by atorvastatin and MK-801","Massari CM, Castro AA, Dal-Cim T, Lanznaster D, Tasca CI.","Toxicol In Vitro. 2016 Dec;37:162-168. doi: 10.1016/j.tiv.2016.09.015. Epub 2016 Sep 17.","Massari CM","Toxicol In Vitro","2016","2016/09/21","","","10.1016/j.tiv.2016.09.015"
"27749013","High motivation for exercise is associated with altered chromatin regulators of monoamine receptor gene expression in the striatum of selectively bred mice","Saul MC, Majdak P, Perez S, Reilly M, Garland T Jr, Rhodes JS.","Genes Brain Behav. 2017 Mar;16(3):328-341. doi: 10.1111/gbb.12347. Epub 2016 Nov 7.","Saul MC","Genes Brain Behav","2017","2016/10/18","","","10.1111/gbb.12347"
"27631684","L-cysteine capped ZnS:Mn quantum dots for room-temperature detection of dopamine with high sensitivity and selectivity","Diaz-Diestra D, Thapa B, Beltran-Huarac J, Weiner BR, Morell G.","Biosens Bioelectron. 2017 Jan 15;87:693-700. doi: 10.1016/j.bios.2016.09.022. Epub 2016 Sep 12.","Diaz-Diestra D","Biosens Bioelectron","2017","2016/09/16","","","10.1016/j.bios.2016.09.022"
"27567900","A brief review on microfluidic platforms for hormones detection","Ozhikandathil J, Badilescu S, Packirisamy M.","J Neural Transm (Vienna). 2017 Jan;124(1):47-55. doi: 10.1007/s00702-016-1610-x. Epub 2016 Aug 27.","Ozhikandathil J","J Neural Transm (Vienna)","2017","2016/08/29","","","10.1007/s00702-016-1610-x"
"27371992","A female case of aromatic l-amino acid decarboxylase deficiency responsive to MAO-B inhibition","Kojima K, Anzai R, Ohba C, Goto T, Miyauchi A, Thöny B, Saitsu H, Matsumoto N, Osaka H, Yamagata T.","Brain Dev. 2016 Nov;38(10):959-963. doi: 10.1016/j.braindev.2016.06.002. Epub 2016 Jun 29.","Kojima K","Brain Dev","2016","2016/07/04","","","10.1016/j.braindev.2016.06.002"
"27226559","Neutralization of RANTES and Eotaxin Prevents the Loss of Dopaminergic Neurons in a Mouse Model of Parkinson Disease","Chandra G, Rangasamy SB, Roy A, Kordower JH, Pahan K.","J Biol Chem. 2016 Jul 15;291(29):15267-81. doi: 10.1074/jbc.M116.714824. Epub 2016 May 12.","Chandra G","J Biol Chem","2016","2016/05/27","PMC4946939","","10.1074/jbc.M116.714824"
"27014596","Role of astrocytic glutamate transporter in alcohol use disorder","Ayers-Ringler JR, Jia YF, Qiu YY, Choi DS.","World J Psychiatry. 2016 Mar 22;6(1):31-42. doi: 10.5498/wjp.v6.i1.31. eCollection 2016 Mar 22.","Ayers-Ringler JR","World J Psychiatry","2016","2016/03/26","PMC4804266","","10.5498/wjp.v6.i1.31"
"26872373","DARPP-32: from neurotransmission to cancer","Belkhiri A, Zhu S, El-Rifai W.","Oncotarget. 2016 Apr 5;7(14):17631-40. doi: 10.18632/oncotarget.7268.","Belkhiri A","Oncotarget","2016","2016/02/13","PMC4951238","","10.18632/oncotarget.7268"
"26851573","Monoamine oxidase and agitation in psychiatric patients","Nikolac Perkovic M, Svob Strac D, Nedic Erjavec G, Uzun S, Podobnik J, Kozumplik O, Vlatkovic S, Pivac N.","Prog Neuropsychopharmacol Biol Psychiatry. 2016 Aug 1;69:131-46. doi: 10.1016/j.pnpbp.2016.02.002. Epub 2016 Feb 4.","Nikolac Perkovic M","Prog Neuropsychopharmacol Biol Psychiatry","2016","2016/02/07","","","10.1016/j.pnpbp.2016.02.002"
"26831810","[Study of Supplementary Analgesics Capable of Reducing the Dosage of Morphine]","Komatsu T.","Yakugaku Zasshi. 2016;136(2):329-35. doi: 10.1248/yakushi.15-00242.","Komatsu T","Yakugaku Zasshi","2016","2016/02/03","","","10.1248/yakushi.15-00242"
"26472340","Insulin/IGF signaling in Drosophila and other insects: factors that regulate production, release and post-release action of the insulin-like peptides","Nässel DR, Vanden Broeck J.","Cell Mol Life Sci. 2016 Jan;73(2):271-90. doi: 10.1007/s00018-015-2063-3. Epub 2015 Oct 15.","Nässel DR","Cell Mol Life Sci","2016","2015/10/17","","","10.1007/s00018-015-2063-3"
"26456352","Purinergic receptors in embryonic and adult neurogenesis","Oliveira Á, Illes P, Ulrich H.","Neuropharmacology. 2016 May;104:272-81. doi: 10.1016/j.neuropharm.2015.10.008. Epub 2015 Oct 9.","Oliveira Á","Neuropharmacology","2016","2015/10/13","","","10.1016/j.neuropharm.2015.10.008"
"27992891","Negative experiences in childhood and the development and course of bipolar disorder","Jaworska-Andryszewska P, Rybakowski J.","Psychiatr Pol. 2016 Oct 31;50(5):989-1000. doi: 10.12740/PP/61159.","Jaworska-Andryszewska P","Psychiatr Pol","2016","2016/12/20","","","10.12740/PP/61159"
"26757896","The effect of nucleus basalis magnocellularis deep brain stimulation on memory function in a rat model of dementia","Lee JE, Jeong DU, Lee J, Chang WS, Chang JW.","BMC Neurol. 2016 Jan 12;16:6. doi: 10.1186/s12883-016-0529-z.","Lee JE","BMC Neurol","2016","2016/01/14","PMC4711102","","10.1186/s12883-016-0529-z"
"27509615","[Effects of electrical stimulation at acupoints in the distribution area of auricular vagus nerve combined with sound masking method on auditory brainstem response and neurotransmitters of inferior colliculus in rats of tinnitus]","Yang S, Mei Z, Tan L, Ma W, Zhang D, Wang Z, Li T, Huang K, Cai S.","Zhongguo Zhen Jiu. 2016 May;36(5):517-22.","Yang S","Zhongguo Zhen Jiu","2016","2016/08/12","","",""
"27989747","Chronic postnatal monoamine oxidase inhibition affects affiliative behavior in rat pupso","Blazevic S, Merkler M, Persic D, Hranilovic D.","Pharmacol Biochem Behav. 2017 Feb;153:60-68. doi: 10.1016/j.pbb.2016.12.008. Epub 2016 Dec 15.","Blazevic S","Pharmacol Biochem Behav","2017","2016/12/20","","","10.1016/j.pbb.2016.12.008"
"27869740","Functional Role of the C-Terminal Amphipathic Helix 8 of Olfactory Receptors and Other G Protein-Coupled Receptors","Sato T, Kawasaki T, Mine S, Matsumura H.","Int J Mol Sci. 2016 Nov 18;17(11):1930. doi: 10.3390/ijms17111930.","Sato T","Int J Mol Sci","2016","2016/11/22","PMC5133925","","10.3390/ijms17111930"
"27604310","Selective cerebral perfusion prevents abnormalities in glutamate cycling and neuronal apoptosis in a model of infant deep hypothermic circulatory arrest and reperfusion","Kajimoto M, Ledee DR, Olson AK, Isern NG, Robillard-Frayne I, Des Rosiers C, Portman MA.","J Cereb Blood Flow Metab. 2016 Nov;36(11):1992-2004. doi: 10.1177/0271678X16666846. Epub 2016 Sep 7.","Kajimoto M","J Cereb Blood Flow Metab","2016","2016/09/09","PMC5094314","","10.1177/0271678X16666846"
"26661195","Brain interstitial fluid glutamine homeostasis is controlled by blood-brain barrier SLC7A5/LAT1 amino acid transporter","Dolgodilina E, Imobersteg S, Laczko E, Welt T, Verrey F, Makrides V.","J Cereb Blood Flow Metab. 2016 Nov;36(11):1929-1941. doi: 10.1177/0271678X15609331. Epub 2015 Oct 19.","Dolgodilina E","J Cereb Blood Flow Metab","2016","2015/12/15","PMC5094305","","10.1177/0271678X15609331"
"27750062","Alterations in the brainstem volume of patients with major depressive disorder and their relationship with antidepressant treatment","Han KM, Kim D, Sim Y, Kang J, Kim A, Won E, Tae WS, Ham BJ.","J Affect Disord. 2017 Jan 15;208:68-75. doi: 10.1016/j.jad.2016.08.066. Epub 2016 Oct 11.","Han KM","J Affect Disord","2017","2016/10/18","","","10.1016/j.jad.2016.08.066"
"27641830","Cholinergic circuits in cognitive flexibility","Prado VF, Janickova H, Al-Onaizi MA, Prado MA.","Neuroscience. 2017 Mar 14;345:130-141. doi: 10.1016/j.neuroscience.2016.09.013. Epub 2016 Sep 15.","Prado VF","Neuroscience","2017","2016/09/20","","","10.1016/j.neuroscience.2016.09.013"
"27564542","Computational Investigation of the Interplay of Substrate Positioning and Reactivity in Catechol O-Methyltransferase","Patra N, Ioannidis EI, Kulik HJ.","PLoS One. 2016 Aug 26;11(8):e0161868. doi: 10.1371/journal.pone.0161868. eCollection 2016.","Patra N","PLoS One","2016","2016/08/27","PMC5001633","","10.1371/journal.pone.0161868"
"27445687","A Recombinant Human Pluripotent Stem Cell Line Stably Expressing Halide-Sensitive YFP-I152L for GABAAR and GlyR-Targeted High-Throughput Drug Screening and Toxicity Testing","Kuenzel K, Friedrich O, Gilbert DF.","Front Mol Neurosci. 2016 Jun 28;9:51. doi: 10.3389/fnmol.2016.00051. eCollection 2016.","Kuenzel K","Front Mol Neurosci","2016","2016/07/23","PMC4923258","","10.3389/fnmol.2016.00051"
"27285311","Magnetic Resonance Spectroscopy in Patients with Insomnia: A Repeated Measurement Study","Spiegelhalder K, Regen W, Nissen C, Feige B, Baglioni C, Riemann D, Hennig J, Lange T.","PLoS One. 2016 Jun 10;11(6):e0156771. doi: 10.1371/journal.pone.0156771. eCollection 2016.","Spiegelhalder K","PLoS One","2016","2016/06/11","PMC4902218","","10.1371/journal.pone.0156771"
"27273305","Deep brain stimulation mechanisms: the control of network activity via neurochemistry modulation","McIntyre CC, Anderson RW.","J Neurochem. 2016 Oct;139 Suppl 1(Suppl 1):338-345. doi: 10.1111/jnc.13649. Epub 2016 Jun 8.","McIntyre CC","J Neurochem","2016","2016/06/09","PMC5358920","NIHMS850907","10.1111/jnc.13649"
"27137992","The reverse role of the hypothalamic paraventricular (PVN) and arcuate (ARC) nuclei in the central serotonergic regulation of the liver cytochrome P450 isoform CYP2C11","Rysz M, Bromek E, Haduch A, Liskova B, Wójcikowski J, Daniel WA.","Biochem Pharmacol. 2016 Jul 15;112:82-9. doi: 10.1016/j.bcp.2016.04.017. Epub 2016 Apr 29.","Rysz M","Biochem Pharmacol","2016","2016/05/04","","","10.1016/j.bcp.2016.04.017"
"27134125","Early life adversity in piglets induces long-term upregulation of the enteric cholinergic nervous system and heightened, sex-specific secretomotor neuron responses","Medland JE, Pohl CS, Edwards LL, Frandsen S, Bagley K, Li Y, Moeser AJ.","Neurogastroenterol Motil. 2016 Sep;28(9):1317-29. doi: 10.1111/nmo.12828. Epub 2016 May 2.","Medland JE","Neurogastroenterol Motil","2016","2016/05/03","PMC5002263","NIHMS767094","10.1111/nmo.12828"
"27091850","The role of macrophage polarization on bipolar disorder: Identifying new therapeutic targets","Ascoli BM, Géa LP, Colombo R, Barbé-Tuana FM, Kapczinski F, Rosa AR.","Aust N Z J Psychiatry. 2016 Jul;50(7):618-30. doi: 10.1177/0004867416642846. Epub 2016 Apr 18.","Ascoli BM","Aust N Z J Psychiatry","2016","2016/04/20","","","10.1177/0004867416642846"
"27048382","Maternal diet of polyunsaturated fatty acid altered the cell proliferation in the dentate gyrus of hippocampus and influenced glutamatergic and serotoninergic systems of neonatal female rats","Tang M, Zhang M, Cai H, Li H, Jiang P, Dang R, Liu Y, He X, Xue Y, Cao L, Wu Y.","Lipids Health Dis. 2016 Apr 5;15:71. doi: 10.1186/s12944-016-0236-1.","Tang M","Lipids Health Dis","2016","2016/04/07","PMC4822267","","10.1186/s12944-016-0236-1"
"26685060","Metabolic profiling for the identification of Huntington biomarkers by on-line solid-phase extraction capillary electrophoresis mass spectrometry combined with advanced data analysis tools","Pont L, Benavente F, Jaumot J, Tauler R, Alberch J, Ginés S, Barbosa J, Sanz-Nebot V.","Electrophoresis. 2016 Mar;37(5-6):795-808. doi: 10.1002/elps.201500378. Epub 2016 Feb 8.","Pont L","Electrophoresis","2016","2015/12/20","","","10.1002/elps.201500378"
"26577887","Magnetic resonance spectroscopy reveals oral Lactobacillus promotion of increases in brain GABA, N-acetyl aspartate and glutamate","Janik R, Thomason LAM, Stanisz AM, Forsythe P, Bienenstock J, Stanisz GJ.","Neuroimage. 2016 Jan 15;125:988-995. doi: 10.1016/j.neuroimage.2015.11.018. Epub 2015 Nov 11.","Janik R","Neuroimage","2016","2015/11/19","","","10.1016/j.neuroimage.2015.11.018"
"26105143","Toward Understanding How Early-Life Stress Reprograms Cognitive and Emotional Brain Networks","Chen Y, Baram TZ.","Neuropsychopharmacology. 2016 Jan;41(1):197-206. doi: 10.1038/npp.2015.181. Epub 2015 Jun 24.","Chen Y","Neuropsychopharmacology","2016","2015/06/25","PMC4677123","","10.1038/npp.2015.181"
"27966041","Glutamate-glutamine and GABA in brain of normal aged and patients with cognitive impairment","Huang D, Liu D, Yin J, Qian T, Shrestha S, Ni H.","Eur Radiol. 2017 Jul;27(7):2698-2705. doi: 10.1007/s00330-016-4669-8. Epub 2016 Dec 13.","Huang D","Eur Radiol","2017","2016/12/15","","","10.1007/s00330-016-4669-8"
"27927655","Role of cannabinoid receptor type 1 in tibial and pudendal neuromodulation of bladder overactivity in cats","Jiang X, Yu M, Uy J, Fuller TW, Jones C, Shen B, Wang J, Roppolo JR, de Groat WC, Tai C.","Am J Physiol Renal Physiol. 2017 Mar 1;312(3):F482-F488. doi: 10.1152/ajprenal.00586.2016. Epub 2016 Dec 7.","Jiang X","Am J Physiol Renal Physiol","2017","2016/12/09","PMC5374309","","10.1152/ajprenal.00586.2016"
"29979510","[Fibromyalgia syndrome: Basic knowledge, diagnosis and treatment]","Häuser W.","Med Monatsschr Pharm. 2016 Dec;39(12):504-11.","Häuser W","Med Monatsschr Pharm","2016","2018/07/07","","",""
"27755991","Risperidone and escitalopram co-administration: A potential treatment of schizophrenia symptoms with less side effects","Kamińska K, Noworyta-Sokołowska K, Jurczak A, Górska A, Rogóż Z, Gołembiowska K.","Pharmacol Rep. 2017 Feb;69(1):13-21. doi: 10.1016/j.pharep.2016.09.010. Epub 2016 Sep 11.","Kamińska K","Pharmacol Rep","2017","2016/10/19","","","10.1016/j.pharep.2016.09.010"
