PMID,Title,Authors,Citation,First Author,Journal/Book,Publication Year,Create Date,PMCID,NIHMS ID,DOI
"27619075","IQ and hemizygosity for the Val(158) Met functional polymorphism of COMT in 22q11DS","Franconi CP, McDonald-McGinn D, Zackai EH, McNamara MA, Salmons H 4th, Moss E, Gur RE, Devoto M, Emanuel BS.","Am J Med Genet B Neuropsychiatr Genet. 2016 Dec;171(8):1112-1115. doi: 10.1002/ajmg.b.32492. Epub 2016 Sep 13.","Franconi CP","Am J Med Genet B Neuropsychiatr Genet","2016","2016/09/14","PMC6733517","NIHMS965741","10.1002/ajmg.b.32492"
"27928707","Effect of Zuogui Pill () on monoamine neurotransmitters and sex hormones in climacteric rats with panic attack","Li XY, Wang XY.","Chin J Integr Med. 2017 Mar;23(3):190-195. doi: 10.1007/s11655-016-2095-4. Epub 2016 Dec 7.","Li XY","Chin J Integr Med","2017","2016/12/09","","","10.1007/s11655-016-2095-4"
"26833072","Synthesis and Evaluation of Phenyliminoindolin-Containing Phenylacetamide Derivatives with the Antidepressant and Anticonvulsant Effects","Guan LP, Liu BY, Quan YC, Yang LY, Zhen XH, Wang SH.","Med Chem. 2016;12(8):786-794. doi: 10.2174/1573406412666160201121456.","Guan LP","Med Chem","2016","2016/02/03","","","10.2174/1573406412666160201121456"
"27111409","Microfluidic Platform with In-Chip Electrophoresis Coupled to Mass Spectrometry for Monitoring Neurochemical Release from Nerve Cells","Li X, Hu H, Zhao S, Liu YM.","Anal Chem. 2016 May 17;88(10):5338-44. doi: 10.1021/acs.analchem.6b00638. Epub 2016 May 4.","Li X","Anal Chem","2016","2016/04/26","PMC5072280","NIHMS821333","10.1021/acs.analchem.6b00638"
"26498070","Cross-talk between α7 nAchR and NMDAR revealed by protein profiling","Zhang H, Li T, Li S, Liu F.","J Proteomics. 2016 Jan 10;131:113-121. doi: 10.1016/j.jprot.2015.10.018. Epub 2015 Oct 21.","Zhang H","J Proteomics","2016","2015/10/27","","","10.1016/j.jprot.2015.10.018"
"28579928","Single cell amperometry reveals curcuminoids modulate the release of neurotransmitters during exocytosis from PC12 cells","Li X, Mohammadi AS, Ewing AG.","J Electroanal Chem (Lausanne). 2016 Nov 15;781:30-35. doi: 10.1016/j.jelechem.2016.10.025. Epub 2016 Oct 13.","Li X","J Electroanal Chem (Lausanne)","2016","2017/06/06","PMC5450664","NIHMS825626","10.1016/j.jelechem.2016.10.025"
"26739126","Targeted pruning of a neuron's dendritic tree via femtosecond laser dendrotomy","Go MA, Choy JM, Colibaba AS, Redman S, Bachor HA, Stricker C, Daria VR.","Sci Rep. 2016 Jan 7;6:19078. doi: 10.1038/srep19078.","Go MA","Sci Rep","2016","2016/01/08","PMC4703956","","10.1038/srep19078"
"28241996","Ginkgo biloba extract alleviates oxidative stress and some neurotransmitters changes induced by aluminum chloride in rats","Mohamed NE, Abd El-Moneim AE.","Nutrition. 2017 Mar;35:93-99. doi: 10.1016/j.nut.2016.10.012. Epub 2016 Oct 26.","Mohamed NE","Nutrition","2017","2017/03/01","","","10.1016/j.nut.2016.10.012"
"27214050","Construction of Cell-based Neurotransmitter Fluorescent Engineered Reporters (CNiFERs) for Optical Detection of Neurotransmitters In Vivo","Lacin E, Muller A, Fernando M, Kleinfeld D, Slesinger PA.","J Vis Exp. 2016 May 12;(111):53290. doi: 10.3791/53290.","Lacin E","J Vis Exp","2016","2016/05/24","PMC4939270","NIHMS797484","10.3791/53290"
"26930260","Daily expression of genes coding for neurotransmitters in central and peripheral tissues of redheaded bunting: Implication for circadian regulation of physiology in songbirds","Mishra I, Singh D, Kumar V.","Chronobiol Int. 2016;33(3):280-92. doi: 10.3109/07420528.2016.1139587. Epub 2016 Mar 1.","Mishra I","Chronobiol Int","2016","2016/03/02","","","10.3109/07420528.2016.1139587"
"26801555","Vesicular monoamine transporter 2 (Vmat2) knockdown elicits anxiety-like behavior in zebrafish","Wang Y, Li S, Liu W, Wang F, Hu LF, Zhong ZM, Wang H, Liu CF.","Biochem Biophys Res Commun. 2016 Feb 19;470(4):792-7. doi: 10.1016/j.bbrc.2016.01.079. Epub 2016 Jan 20.","Wang Y","Biochem Biophys Res Commun","2016","2016/01/24","","","10.1016/j.bbrc.2016.01.079"
"27695666","The Neurobiological Basis for Social Affiliation in Autism Spectrum Disorder and Schizophrenia","Crider A, Pillai A.","Curr Behav Neurosci Rep. 2016 Jun;3(2):154-164. doi: 10.1007/s40473-016-0079-0. Epub 2016 Apr 16.","Crider A","Curr Behav Neurosci Rep","2016","2016/10/04","PMC5042200","NIHMS779148","10.1007/s40473-016-0079-0"
"27341781","(-)-Epicatechin derivate from Orostachys japonicus as potential inhibitor of the human butyrylcholinesterase","Kim JH, Lee SH, Lee HW, Sun YN, Jang WH, Yang SY, Jang HD, Kim YH.","Int J Biol Macromol. 2016 Oct;91:1033-9. doi: 10.1016/j.ijbiomac.2016.06.069. Epub 2016 Jun 21.","Kim JH","Int J Biol Macromol","2016","2016/06/26","","","10.1016/j.ijbiomac.2016.06.069"
"26916821","Electrochemical Label-Free Aptasensor for Specific Analysis of Dopamine in Serum in the Presence of Structurally Related Neurotransmitters","Álvarez-Martos I, Ferapontova EE.","Anal Chem. 2016 Apr 5;88(7):3608-16. doi: 10.1021/acs.analchem.5b04207. Epub 2016 Mar 8.","Álvarez-Martos I","Anal Chem","2016","2016/02/27","","","10.1021/acs.analchem.5b04207"
"26960008","Direct affinity of dopamine to lipid membranes investigated by Nuclear Magnetic Resonance spectroscopy","Matam Y, Ray BD, Petrache HI.","Neurosci Lett. 2016 Apr 8;618:104-109. doi: 10.1016/j.neulet.2016.02.052. Epub 2016 Mar 6.","Matam Y","Neurosci Lett","2016","2016/03/10","","","10.1016/j.neulet.2016.02.052"
"27458335","A Simplified In vitro Experimental Model Encompasses the Essential Features of Sleep","Colombi I, Tinarelli F, Pasquale V, Tucci V, Chiappalone M.","Front Neurosci. 2016 Jul 7;10:315. doi: 10.3389/fnins.2016.00315. eCollection 2016.","Colombi I","Front Neurosci","2016","2016/07/27","PMC4935686","","10.3389/fnins.2016.00315"
"27288591","Non-parametric analysis of neurochemical effects and Arc expression in amphetamine-induced 50-kHz ultrasonic vocalization","Hamed A, Daszczuk P, Kursa MB, Turzyńska D, Sobolewska A, Lehner M, Boguszewski PM, Szyndler J.","Behav Brain Res. 2016 Oct 1;312:174-85. doi: 10.1016/j.bbr.2016.05.042. Epub 2016 Jun 8.","Hamed A","Behav Brain Res","2016","2016/06/12","","","10.1016/j.bbr.2016.05.042"
"26867655","A Therapeutic Insight of Niacin and Coenzyme Q10 Against Diabetic Encephalopathy in Rats","Motawi TK, Darwish HA, Hamed MA, El-Rigal NS, Naser AFA.","Mol Neurobiol. 2017 Apr;54(3):1601-1611. doi: 10.1007/s12035-016-9765-x. Epub 2016 Feb 11.","Motawi TK","Mol Neurobiol","2017","2016/02/13","","","10.1007/s12035-016-9765-x"
"27669145","A visual circuit uses complementary mechanisms to support transient and sustained pupil constriction","Keenan WT, Rupp AC, Ross RA, Somasundaram P, Hiriyanna S, Wu Z, Badea TC, Robinson PR, Lowell BB, Hattar SS.","Elife. 2016 Sep 26;5:e15392. doi: 10.7554/eLife.15392.","Keenan WT","Elife","2016","2016/09/27","PMC5079752","","10.7554/eLife.15392"
"27424322","Serum serotonin as unexpected potential marker for staging of experimental hepatocellular carcinoma","Abdel-Hamid NM, Shehata DE, Abdel-Ghany AA, Ragaa A, Wahid A.","Biomed Pharmacother. 2016 Oct;83:407-411. doi: 10.1016/j.biopha.2016.07.005. Epub 2016 Jul 15.","Abdel-Hamid NM","Biomed Pharmacother","2016","2016/07/18","","","10.1016/j.biopha.2016.07.005"
"27193598","The simple neuroendocrine-immune regulatory network in oyster Crassostrea gigas mediates complex functions","Liu Z, Wang L, Zhou Z, Sun Y, Wang M, Wang H, Hou Z, Gao D, Gao Q, Song L.","Sci Rep. 2016 May 19;6:26396. doi: 10.1038/srep26396.","Liu Z","Sci Rep","2016","2016/05/20","PMC4872224","","10.1038/srep26396"
"27488225","Shifting blame: Buprenorphine prescribers, addiction treatment, and prescription monitoring in middle-class America","Mendoza S, Rivera-Cabrero AS, Hansen H.","Transcult Psychiatry. 2016 Aug;53(4):465-87. doi: 10.1177/1363461516660884. Epub 2016 Aug 3.","Mendoza S","Transcult Psychiatry","2016","2016/08/05","PMC5540139","NIHMS839281","10.1177/1363461516660884"
"26820595","Tissue-type plasminogen activator induces synaptic vesicle endocytosis in cerebral cortical neurons","Yepes M, Wu F, Torre E, Cuellar-Giraldo D, Jia D, Cheng L.","Neuroscience. 2016 Apr 5;319:69-78. doi: 10.1016/j.neuroscience.2016.01.046. Epub 2016 Jan 26.","Yepes M","Neuroscience","2016","2016/01/29","PMC4762727","NIHMS754688","10.1016/j.neuroscience.2016.01.046"
"26869263","Loss of UBE3A from TH-expressing neurons suppresses GABA co-release and enhances VTA-NAc optical self-stimulation","Berrios J, Stamatakis AM, Kantak PA, McElligott ZA, Judson MC, Aita M, Rougie M, Stuber GD, Philpot BD.","Nat Commun. 2016 Feb 12;7:10702. doi: 10.1038/ncomms10702.","Berrios J","Nat Commun","2016","2016/02/13","PMC4754338","","10.1038/ncomms10702"
"26821120","Microglia PACAP and glutamate: Friends or foes in seizure-induced autonomic dysfunction and SUDEP?","Bhandare AM, Kapoor K, Farnham MM, Pilowsky PM.","Respir Physiol Neurobiol. 2016 Jun;226:39-50. doi: 10.1016/j.resp.2016.01.003. Epub 2016 Jan 26.","Bhandare AM","Respir Physiol Neurobiol","2016","2016/01/29","","","10.1016/j.resp.2016.01.003"
"27870840","Single-nanotube tracking reveals the nanoscale organization of the extracellular space in the live brain","Godin AG, Varela JA, Gao Z, Danné N, Dupuis JP, Lounis B, Groc L, Cognet L.","Nat Nanotechnol. 2017 Mar;12(3):238-243. doi: 10.1038/nnano.2016.248. Epub 2016 Nov 21.","Godin AG","Nat Nanotechnol","2017","2016/11/22","","","10.1038/nnano.2016.248"
"26715233","Monoamine Release during Unihemispheric Sleep and Unihemispheric Waking in the Fur Seal","Lyamin OI, Lapierre JL, Kosenko PO, Kodama T, Bhagwandin A, Korneva SM, Peever JH, Mukhametov LM, Siegel JM.","Sleep. 2016 Mar 1;39(3):625-36. doi: 10.5665/sleep.5540.","Lyamin OI","Sleep","2016","2015/12/31","PMC4763370","","10.5665/sleep.5540"
"27164608","A Survey of Memristive Threshold Logic Circuits","Maan AK, Jayadevi DA, James AP.","IEEE Trans Neural Netw Learn Syst. 2017 Aug;28(8):1734-1746. doi: 10.1109/TNNLS.2016.2547842. Epub 2016 May 3.","Maan AK","IEEE Trans Neural Netw Learn Syst","2017","2016/05/11","","","10.1109/TNNLS.2016.2547842"
"27136975","The conformational space of the neurotransmitter serotonin: how the rotation of a hydroxyl group changes all","Wilke M, Brand C, Wilke J, Schmitt M.","Phys Chem Chem Phys. 2016 May 11;18(19):13538-45. doi: 10.1039/c6cp02130a.","Wilke M","Phys Chem Chem Phys","2016","2016/05/04","","","10.1039/c6cp02130a"
"26999360","Detection of four different amino acid neurotransmitters in cultured rat neurons and the culture medium by precolumn derivatization high-performance liquid chromatography","Zhang F, Ma XL, Wang YX, Su RR, He C, Tian K, Liu YQ.","Neuroreport. 2016 May 4;27(7):495-500. doi: 10.1097/WNR.0000000000000568.","Zhang F","Neuroreport","2016","2016/03/22","","","10.1097/WNR.0000000000000568"
"26673618","Differential expression of neurogenes among breast cancer subtypes identifies high risk patients","Fernández-Nogueira P, Bragado P, Almendro V, Ametller E, Rios J, Choudhury S, Mancino M, Gascón P.","Oncotarget. 2016 Feb 2;7(5):5313-26. doi: 10.18632/oncotarget.6543.","Fernández-Nogueira P","Oncotarget","2016","2015/12/18","PMC4868688","","10.18632/oncotarget.6543"
"26866575","Changes in Neurotransmitter Profiles during Early Zebrafish (Danio rerio) Development and after Pesticide Exposure","Tufi S, Leonards P, Lamoree M, de Boer J, Legler J, Legradi J.","Environ Sci Technol. 2016 Mar 15;50(6):3222-30. doi: 10.1021/acs.est.5b05665. Epub 2016 Feb 25.","Tufi S","Environ Sci Technol","2016","2016/02/12","","","10.1021/acs.est.5b05665"
"27915002","Label-free histamine detection with nanofluidic diodes through metal ion displacement mechanism","Ali M, Ramirez P, Duznovic I, Nasir S, Mafe S, Ensinger W.","Colloids Surf B Biointerfaces. 2017 Feb 1;150:201-208. doi: 10.1016/j.colsurfb.2016.11.038. Epub 2016 Nov 28.","Ali M","Colloids Surf B Biointerfaces","2017","2016/12/05","","","10.1016/j.colsurfb.2016.11.038"
"26996083","Segregated Glycine-Glutamate Co-transmission from vGluT3 Amacrine Cells to Contrast-Suppressed and Contrast-Enhanced Retinal Circuits","Lee S, Zhang Y, Chen M, Zhou ZJ.","Neuron. 2016 Apr 6;90(1):27-34. doi: 10.1016/j.neuron.2016.02.023. Epub 2016 Mar 17.","Lee S","Neuron","2016","2016/03/22","PMC4824647","NIHMS762081","10.1016/j.neuron.2016.02.023"
"26639609","Carbon Nanotubes Grown on Metal Microelectrodes for the Detection of Dopamine","Yang C, Jacobs CB, Nguyen MD, Ganesana M, Zestos AG, Ivanov IN, Puretzky AA, Rouleau CM, Geohegan DB, Venton BJ.","Anal Chem. 2016 Jan 5;88(1):645-52. doi: 10.1021/acs.analchem.5b01257. Epub 2015 Dec 21.","Yang C","Anal Chem","2016","2015/12/08","PMC4718531","","10.1021/acs.analchem.5b01257"
"27021360","The role of alpha-synuclein in the development of the dopaminergic neurons in the substantia nigra and ventral tegmental area","Tarasova TV, Lytkina OA, Roman AY, Bachurin SO, Ustyugov AA.","Dokl Biol Sci. 2016;466:5-7. doi: 10.1134/S0012496616010117. Epub 2016 Mar 30.","Tarasova TV","Dokl Biol Sci","2016","2016/03/30","","","10.1134/S0012496616010117"
"27776994","Combined effects of antiorthostatic suspension and ionizing radiation on the behaviour and neurotransmitters changes in different brain structures of rats","Kokhan VS, Matveeva MI, Bazyan AS, Kudrin VS, Mukhametov A, Shtemberg AS.","Behav Brain Res. 2017 Mar 1;320:473-483. doi: 10.1016/j.bbr.2016.10.032. Epub 2016 Oct 21.","Kokhan VS","Behav Brain Res","2017","2016/11/08","","","10.1016/j.bbr.2016.10.032"
"27413389","Antidepressant-Like Effects of Fractions Prepared from Danzhi-Xiaoyao-San Decoction in Rats with Chronic Unpredictable Mild Stress: Effects on Hypothalamic-Pituitary-Adrenal Axis, Arginine Vasopressin, and Neurotransmitters","Wu LL, Liu Y, Yan C, Pan Y, Su JF, Wu WK.","Evid Based Complement Alternat Med. 2016;2016:6784689. doi: 10.1155/2016/6784689. Epub 2016 Jun 20.","Wu LL","Evid Based Complement Alternat Med","2016","2016/07/15","PMC4931053","","10.1155/2016/6784689"
"28039808","Analysis of amino acid and monoamine neurotransmitters and their metabolites in rat urine of Alzheimer's disease using in situ ultrasound-assisted derivatization dispersive liquid-liquid microextraction with UHPLC-MS/MS","Zhao XE, He Y, Li M, Chen G, Wei N, Wang X, Sun J, Zhu S, You J.","J Pharm Biomed Anal. 2017 Feb 20;135:186-198. doi: 10.1016/j.jpba.2016.11.056. Epub 2016 Dec 26.","Zhao XE","J Pharm Biomed Anal","2017","2017/01/01","","","10.1016/j.jpba.2016.11.056"
"27318897","[Effects of 1,3-diphenyl-1,3-propanedione on neurotransmitter contents of brain in mice administered with cocaine]","Chen J, Wang YC, Cui R, Liu XX, Zhang BX.","Beijing Da Xue Xue Bao Yi Xue Ban. 2016 Jun 18;48(3):398-402.","Chen J","Beijing Da Xue Xue Bao Yi Xue Ban","2016","2016/06/20","","",""
"27646398","NADPH-diaphorase-positive neurons in the human inferior colliculus: morphology, distribution and clinical implications","Hinova-Palova D, Landzhov B, Dzhambazova E, Edelstein L, Minkov M, Fakih K, Minkov R, Paloff A, Ovtscharoff W.","Brain Struct Funct. 2017 May;222(4):1829-1846. doi: 10.1007/s00429-016-1310-1. Epub 2016 Sep 19.","Hinova-Palova D","Brain Struct Funct","2017","2016/09/21","","","10.1007/s00429-016-1310-1"
"26922362","L-Theanine Improves Immunity by Altering TH2/TH1 Cytokine Balance, Brain Neurotransmitters, and Expression of Phospholipase C in Rat Hearts","Li C, Tong H, Yan Q, Tang S, Han X, Xiao W, Tan Z.","Med Sci Monit. 2016 Feb 28;22:662-9. doi: 10.12659/msm.897077.","Li C","Med Sci Monit","2016","2016/02/29","PMC4772912","","10.12659/msm.897077"
"28078250","Effects of Mimosa pudica L. leaves extract on anxiety, depression and memory","Patro G, Kumar Bhattamisra S, Kumar Mohanty B.","Avicenna J Phytomed. 2016 Nov-Dec;6(6):696-710.","Patro G","Avicenna J Phytomed","2016","2017/01/13","PMC5206927","",""
"27282823","Performance of MRS in metabolic profiling of the lumbar spinal cord in rat and mice","Amirmohseni S, Wachsmuth L, Just N, Faber C.","Magn Reson Imaging. 2016 Oct;34(8):1155-60. doi: 10.1016/j.mri.2016.06.001. Epub 2016 Jun 7.","Amirmohseni S","Magn Reson Imaging","2016","2016/06/11","","","10.1016/j.mri.2016.06.001"
"27095027","The local expression and trafficking of tyrosine hydroxylase mRNA in the axons of sympathetic neurons","Gervasi NM, Scott SS, Aschrafi A, Gale J, Vohra SN, MacGibeny MA, Kar AN, Gioio AE, Kaplan BB.","RNA. 2016 Jun;22(6):883-95. doi: 10.1261/rna.053272.115. Epub 2016 Apr 19.","Gervasi NM","RNA","2016","2016/04/21","PMC4878614","","10.1261/rna.053272.115"
"28078839","Widespread membrane potential changes and cardiorespiratory synchronization involved in anxiety and sleep-wake transitions","Jerath R, Cearley SM, Jensen M.","J Biol Regul Homeost Agents. 2016 Oct-Dec;30(4):935-944.","Jerath R","J Biol Regul Homeost Agents","2016","2017/01/13","","",""
"27060969","Neurotransmitter signaling pathways required for normal development in Xenopus laevis embryos: a pharmacological survey screen","Sullivan KG, Levin M.","J Anat. 2016 Oct;229(4):483-502. doi: 10.1111/joa.12467. Epub 2016 Apr 7.","Sullivan KG","J Anat","2016","2016/04/11","PMC5013058","NIHMS782296","10.1111/joa.12467"
"26486177","Three Gaseous Neurotransmitters, Nitric oxide, Carbon Monoxide, and Hydrogen Sulfide, Are Involved in the Neurogenic Relaxation Responses of the Porcine Internal Anal Sphincter","Folasire O, Mills KA, Sellers DJ, Chess-Williams R.","J Neurogastroenterol Motil. 2016 Jan 31;22(1):141-8. doi: 10.5056/jnm15036.","Folasire O","J Neurogastroenterol Motil","2016","2015/10/22","PMC4699731","","10.5056/jnm15036"
"27454241","Individual variability in verbal fluency correlates with γ-aminobutyric acid concentration in the left inferior frontal gyrus","Nakai T, Okanoya K.","Neuroreport. 2016 Sep 7;27(13):987-91. doi: 10.1097/WNR.0000000000000645.","Nakai T","Neuroreport","2016","2016/07/26","","","10.1097/WNR.0000000000000645"
"26903298","Central nervous system promotes thermotolerance via FoxO/DAF-16 activation through octopamine and acetylcholine signaling in Caenorhabditis elegans","Furuhashi T, Sakamoto K.","Biochem Biophys Res Commun. 2016 Mar 25;472(1):114-7. doi: 10.1016/j.bbrc.2016.02.076. Epub 2016 Feb 20.","Furuhashi T","Biochem Biophys Res Commun","2016","2016/02/24","","","10.1016/j.bbrc.2016.02.076"
"27590559","Quantification of the neurotransmitters melatonin and N-acetyl-serotonin in human serum by supercritical fluid chromatography coupled with tandem mass spectrometry","Wolrab D, Frühauf P, Gerner C.","Anal Chim Acta. 2016 Sep 21;937:168-74. doi: 10.1016/j.aca.2016.08.012. Epub 2016 Aug 16.","Wolrab D","Anal Chim Acta","2016","2016/09/04","","","10.1016/j.aca.2016.08.012"
"27861337","The levels of monoamine neurotransmitters and measures of mental and emotional health in HCV patients treated with ledipasvir (LDV) and sofosbuvir (SOF) with or without ribavirin (RBV)","Golabi P, Elsheikh E, Karrar A, Estep JM, Younossi I, Stepanova M, Gerber L, Younossi ZM.","Medicine (Baltimore). 2016 Nov;95(46):e5066. doi: 10.1097/MD.0000000000005066.","Golabi P","Medicine (Baltimore)","2016","2016/11/19","PMC5120894","","10.1097/MD.0000000000005066"
"26812177","An optimized method for neurotransmitters and their metabolites analysis in mouse hypothalamus by high performance liquid chromatography-Q Exactive hybrid quadrupole-orbitrap high-resolution accurate mass spectrometry","Yang ZL, Li H, Wang B, Liu SY.","J Chromatogr B Analyt Technol Biomed Life Sci. 2016 Feb 15;1012-1013:79-88. doi: 10.1016/j.jchromb.2016.01.008. Epub 2016 Jan 14.","Yang ZL","J Chromatogr B Analyt Technol Biomed Life Sci","2016","2016/01/27","","","10.1016/j.jchromb.2016.01.008"
"27694974","Antidepressant indatraline induces autophagy and inhibits restenosis via suppression of mTOR/S6 kinase signaling pathway","Cho YS, Yen CN, Shim JS, Kang DH, Kang SW, Liu JO, Kwon HJ.","Sci Rep. 2016 Oct 3;6:34655. doi: 10.1038/srep34655.","Cho YS","Sci Rep","2016","2016/10/04","PMC5046148","","10.1038/srep34655"
"26753703","Evaluation of a Portable Microchip Electrophoresis Fluorescence Detection System for the Analysis of Amino Acid Neurotransmitters in Brain Dialysis Samples","Oborny NJ, Costa EE, Suntornsuk L, Abreu FC, Lunte SM.","Anal Sci. 2016;32(1):35-40. doi: 10.2116/analsci.32.35.","Oborny NJ","Anal Sci","2016","2016/01/13","PMC4875779","NIHMS782567","10.2116/analsci.32.35"
"27206901","Neurotransmitter and their metabolite concentrations in different areas of the HPRT knockout mouse brain","Tschirner SK, Gutzki F, Schneider EH, Seifert R, Kaever V.","J Neurol Sci. 2016 Jun 15;365:169-74. doi: 10.1016/j.jns.2016.04.025. Epub 2016 Apr 16.","Tschirner SK","J Neurol Sci","2016","2016/05/22","","","10.1016/j.jns.2016.04.025"
"27379407","Simultaneous quantification of monoamine neurotransmitters and their biogenic metabolites intracellularly and extracellularly in primary neuronal cell cultures and in sub-regions of guinea pig brain","Schou-Pedersen AMV, Hansen SN, Tveden-Nyborg P, Lykkesfeldt J.","J Chromatogr B Analyt Technol Biomed Life Sci. 2016 Aug 15;1028:222-230. doi: 10.1016/j.jchromb.2016.05.048. Epub 2016 Jun 16.","Schou-Pedersen AMV","J Chromatogr B Analyt Technol Biomed Life Sci","2016","2016/07/06","","","10.1016/j.jchromb.2016.05.048"
"26632772","Active-Site Engineering Expands the Substrate Profile of the Basidiomycete L-Tryptophan Decarboxylase CsTDC","Kalb D, Gressler J, Hoffmeister D.","Chembiochem. 2016 Jan;17(2):132-6. doi: 10.1002/cbic.201500438. Epub 2015 Dec 3.","Kalb D","Chembiochem","2016","2015/12/04","","","10.1002/cbic.201500438"
"27688915","Wnt5a Increases the Glycolytic Rate and the Activity of the Pentose Phosphate Pathway in Cortical Neurons","Cisternas P, Salazar P, Silva-Álvarez C, Barros LF, Inestrosa NC.","Neural Plast. 2016;2016:9839348. doi: 10.1155/2016/9839348. Epub 2016 Sep 5.","Cisternas P","Neural Plast","2016","2016/10/01","PMC5027320","","10.1155/2016/9839348"
"27717093","Spatial variability and reproducibility of GABA-edited MEGA-LASER 3D-MRSI in the brain at 3 T","Hnilicová P, Považan M, Strasser B, Andronesi OC, Gajdošík M, Dydak U, Ukropec J, Dobrota D, Trattnig S, Bogner W.","NMR Biomed. 2016 Nov;29(11):1656-1665. doi: 10.1002/nbm.3613. Epub 2016 Oct 7.","Hnilicová P","NMR Biomed","2016","2016/10/08","PMC5095789","","10.1002/nbm.3613"
"27009763","Inhibiting effects of rhynchophylline on zebrafish methamphetamine dependence are associated with amelioration of neurotransmitters content and down-regulation of TH and NR2B expression","Jiang M, Chen Y, Li C, Peng Q, Fang M, Liu W, Kang Q, Lin Y, Yung KK, Mo Z.","Prog Neuropsychopharmacol Biol Psychiatry. 2016 Jul 4;68:31-43. doi: 10.1016/j.pnpbp.2016.03.004. Epub 2016 Mar 21.","Jiang M","Prog Neuropsychopharmacol Biol Psychiatry","2016","2016/03/25","","","10.1016/j.pnpbp.2016.03.004"
"27336704","Validated methods for determination of neurotransmitters and metabolites in rodent brain tissue and extracellular fluid by reversed phase UHPLC-MS/MS","Bergh MS, Bogen IL, Lundanes E, Øiestad ÅML.","J Chromatogr B Analyt Technol Biomed Life Sci. 2016 Aug 15;1028:120-129. doi: 10.1016/j.jchromb.2016.06.011. Epub 2016 Jun 7.","Bergh MS","J Chromatogr B Analyt Technol Biomed Life Sci","2016","2016/06/24","","","10.1016/j.jchromb.2016.06.011"
"27549338","High-frequency stimulation-induced peptide release synchronizes arcuate kisspeptin neurons and excites GnRH neurons","Qiu J, Nestor CC, Zhang C, Padilla SL, Palmiter RD, Kelly MJ, Rønnekleiv OK.","Elife. 2016 Aug 23;5:e16246. doi: 10.7554/eLife.16246.","Qiu J","Elife","2016","2016/08/24","PMC4995096","","10.7554/eLife.16246"
"26972279","Changes of excitatory and inhibitory neurotransmitters in the colon of rats underwent to the wrap partial restraint stress","Traini C, Evangelista S, Girod V, Faussone-Pellegrini MS, Vannucchi MG.","Neurogastroenterol Motil. 2016 Aug;28(8):1172-85. doi: 10.1111/nmo.12816. Epub 2016 Mar 12.","Traini C","Neurogastroenterol Motil","2016","2016/03/15","","","10.1111/nmo.12816"
"26610905","Extracellular levels of ATP and acetylcholine during lithium-pilocarpine induced status epilepticus in rats","Lietsche J, Imran I, Klein J.","Neurosci Lett. 2016 Jan 12;611:69-73. doi: 10.1016/j.neulet.2015.11.028. Epub 2015 Dec 2.","Lietsche J","Neurosci Lett","2016","2015/11/28","","","10.1016/j.neulet.2015.11.028"
"27497314","Variation in the oxytocin receptor gene (OXTR) is associated with differences in moral judgment","Bernhard RM, Chaponis J, Siburian R, Gallagher P, Ransohoff K, Wikler D, Perlis RH, Greene JD.","Soc Cogn Affect Neurosci. 2016 Dec;11(12):1872-1881. doi: 10.1093/scan/nsw103. Epub 2016 Aug 6.","Bernhard RM","Soc Cogn Affect Neurosci","2016","2016/08/07","PMC5141955","","10.1093/scan/nsw103"
"27491021","Structural basis for cholinergic regulation of neural circuits in the mouse olfactory bulb","Hamamoto M, Kiyokage E, Sohn J, Hioki H, Harada T, Toida K.","J Comp Neurol. 2017 Feb 15;525(3):574-591. doi: 10.1002/cne.24088. Epub 2016 Aug 30.","Hamamoto M","J Comp Neurol","2017","2016/08/05","","","10.1002/cne.24088"
"27793236","Isoflurane provides neuroprotection in neonatal hypoxic ischemic brain injury by suppressing apoptosis","Zhao DA, Bi LY, Huang Q, Zhang FM, Han ZM.","Braz J Anesthesiol. 2016 Nov-Dec;66(6):613-621. doi: 10.1016/j.bjane.2015.04.008. Epub 2016 May 30.","Zhao DA","Braz J Anesthesiol","2016","2016/10/30","","","10.1016/j.bjane.2015.04.008"
"27783296","Effects of Single Administration of Bupropion on Carboxypeptidase E Activity in Structures of Rat Brain","Kruchinina AD, Gamzin SS, Tengin MT.","Bull Exp Biol Med. 2016 Oct;161(6):788-791. doi: 10.1007/s10517-016-3511-2. Epub 2016 Oct 26.","Kruchinina AD","Bull Exp Biol Med","2016","2016/10/27","","","10.1007/s10517-016-3511-2"
