PMID,Title,Authors,Citation,First Author,Journal/Book,Publication Year,Create Date,PMCID,NIHMS ID,DOI
"27809760","Deep sequencing of transcriptomes from the nervous systems of two decapod crustaceans to characterize genes important for neural circuit function and modulation","Northcutt AJ, Lett KM, Garcia VB, Diester CM, Lane BJ, Marder E, Schulz DJ.","BMC Genomics. 2016 Nov 4;17(1):868. doi: 10.1186/s12864-016-3215-z.","Northcutt AJ","BMC Genomics","2016","2016/11/05","PMC5096308","","10.1186/s12864-016-3215-z"
"27355756","In vitro screening for inhibitor of cloned Drosophila melanogaster tyramine-β-hydroxylase and docking studies","Hasan MN, Hosen MJ, Thakur PK, Abir RA, Zubaer A, Renkai G, Yoshida M, Ohta H, Lee JM, Kusakabe T, Hirashima A.","Int J Biol Macromol. 2016 Dec;93(Pt A):889-895. doi: 10.1016/j.ijbiomac.2016.06.026. Epub 2016 Jun 26.","Hasan MN","Int J Biol Macromol","2016","2016/06/30","","","10.1016/j.ijbiomac.2016.06.026"
"27706666","Anti-nociceptive effects of Paecilomyces hepiali via multiple pathways in mouse models","Wang C, Wang J, Jia D, Li L, Jia B, Fan S, Song J, Hu X, Wang Y, Wang D.","Genet Mol Res. 2016 Aug 30;15(3). doi: 10.4238/gmr.15038996.","Wang C","Genet Mol Res","2016","2016/10/06","","","10.4238/gmr.15038996"
"27611726","Genetic polymorphisms in the serotonergic system are associated with circadian manifestations of bruxism","Oporto GH 5th, Bornhardt T, Iturriaga V, Salazar LA.","J Oral Rehabil. 2016 Nov;43(11):805-812. doi: 10.1111/joor.12436. Epub 2016 Sep 20.","Oporto GH 5th","J Oral Rehabil","2016","2016/09/10","","","10.1111/joor.12436"
"27601664","Unique pH dynamics in GABAergic synaptic vesicles illuminates the mechanism and kinetics of GABA loading","Egashira Y, Takase M, Watanabe S, Ishida J, Fukamizu A, Kaneko R, Yanagawa Y, Takamori S.","Proc Natl Acad Sci U S A. 2016 Sep 20;113(38):10702-7. doi: 10.1073/pnas.1604527113. Epub 2016 Sep 6.","Egashira Y","Proc Natl Acad Sci U S A","2016","2016/09/08","PMC5035854","","10.1073/pnas.1604527113"
"27371023","Enantioseparation of the constituents involved in the phenylalanine-tyrosine metabolic pathway by capillary electrophoresis tandem mass spectrometry","Sánchez-López E, Marcos A, Ambrosio E, Marina ML, Crego AL.","J Chromatogr A. 2016 Oct 7;1467:372-382. doi: 10.1016/j.chroma.2016.06.053. Epub 2016 Jun 17.","Sánchez-López E","J Chromatogr A","2016","2016/07/03","","","10.1016/j.chroma.2016.06.053"
"27312429","Psychosis in Parkinson's Disease: Epidemiology, Pathophysiology, and Management","Chang A, Fox SH.","Drugs. 2016 Jul;76(11):1093-118. doi: 10.1007/s40265-016-0600-5.","Chang A","Drugs","2016","2016/06/18","","","10.1007/s40265-016-0600-5"
"27296116","Presynaptic control of inhibitory neurotransmitter content in VIAAT containing synaptic vesicles","Aubrey KR.","Neurochem Int. 2016 Sep;98:94-102. doi: 10.1016/j.neuint.2016.06.002. Epub 2016 Jun 11.","Aubrey KR","Neurochem Int","2016","2016/06/15","","","10.1016/j.neuint.2016.06.002"
"27291902","Dopamine Targeting Drugs for the Treatment of Schizophrenia: Past, Present and Future","Li P, Snyder GL, Vanover KE.","Curr Top Med Chem. 2016;16(29):3385-3403. doi: 10.2174/1568026616666160608084834.","Li P","Curr Top Med Chem","2016","2016/06/14","PMC5112764","","10.2174/1568026616666160608084834"
"27254412","Posttraumatic Stress Disorder: Does the Gut Microbiome Hold the Key?","Leclercq S, Forsythe P, Bienenstock J.","Can J Psychiatry. 2016 Apr;61(4):204-13. doi: 10.1177/0706743716635535. Epub 2016 Feb 24.","Leclercq S","Can J Psychiatry","2016","2016/06/03","PMC4794957","","10.1177/0706743716635535"
"27121468","Two types of interneurons in the mouse lateral geniculate nucleus are characterized by different h-current density","Leist M, Datunashvilli M, Kanyshkova T, Zobeiri M, Aissaoui A, Cerina M, Romanelli MN, Pape HC, Budde T.","Sci Rep. 2016 Apr 28;6:24904. doi: 10.1038/srep24904.","Leist M","Sci Rep","2016","2016/04/29","PMC4848471","","10.1038/srep24904"
"27032815","Effects of Perfluorooctanoic Acid on Metabolic Profiles in Brain and Liver of Mouse Revealed by a High-throughput Targeted Metabolomics Approach","Yu N, Wei S, Li M, Yang J, Li K, Jin L, Xie Y, Giesy JP, Zhang X, Yu H.","Sci Rep. 2016 Apr 1;6:23963. doi: 10.1038/srep23963.","Yu N","Sci Rep","2016","2016/04/02","PMC4817033","","10.1038/srep23963"
"27026110","Effects of lack of microRNA-34 on the neural circuitry underlying the stress response and anxiety","Andolina D, Di Segni M, Bisicchia E, D'Alessandro F, Cestari V, Ventura A, Concepcion C, Puglisi-Allegra S, Ventura R.","Neuropharmacology. 2016 Aug;107:305-316. doi: 10.1016/j.neuropharm.2016.03.044. Epub 2016 Mar 26.","Andolina D","Neuropharmacology","2016","2016/03/31","PMC5573597","NIHMS875495","10.1016/j.neuropharm.2016.03.044"
"27018173","Differential involvement of glutamatergic and catecholaminergic activity within the amygdala during taste aversion retrieval on memory expression and updating","Osorio-Gómez D, Guzmán-Ramos K, Bermúdez-Rattoni F.","Behav Brain Res. 2016 Jul 1;307:120-5. doi: 10.1016/j.bbr.2016.03.038. Epub 2016 Mar 23.","Osorio-Gómez D","Behav Brain Res","2016","2016/03/29","","","10.1016/j.bbr.2016.03.038"
"27013113","Telocytes in their context with other intercellular communication agents","Edelstein L, Fuxe K, Levin M, Popescu BO, Smythies J.","Semin Cell Dev Biol. 2016 Jul;55:9-13. doi: 10.1016/j.semcdb.2016.03.010. Epub 2016 Mar 21.","Edelstein L","Semin Cell Dev Biol","2016","2016/03/26","","","10.1016/j.semcdb.2016.03.010"
"26845123","Neuronal Acetylcholine Nicotinic Receptors as New Targets for Lung Cancer Treatment","Mucchietto V, Crespi A, Fasoli F, Clementi F, Gotti C.","Curr Pharm Des. 2016;22(14):2160-9. doi: 10.2174/1381612822666160203144114.","Mucchietto V","Curr Pharm Des","2016","2016/02/05","","","10.2174/1381612822666160203144114"
"26758246","Failure of Standard Training Sets in the Analysis of Fast-Scan Cyclic Voltammetry Data","Johnson JA, Rodeberg NT, Wightman RM.","ACS Chem Neurosci. 2016 Mar 16;7(3):349-59. doi: 10.1021/acschemneuro.5b00302. Epub 2016 Jan 27.","Johnson JA","ACS Chem Neurosci","2016","2016/01/14","PMC5136453","NIHMS831787","10.1021/acschemneuro.5b00302"
"26505192","Zebrafish Olfacto-Retinal Centrifugal Axon Projection and Distribution: Effects of Gonadotropin-Releasing Hormone and Dopaminergic Signaling","Pfister D, Yu C, Kim DS, Li J, Drewing A, Li L.","Dev Neurosci. 2016;38(1):27-33. doi: 10.1159/000439524. Epub 2015 Oct 28.","Pfister D","Dev Neurosci","2016","2015/10/28","","","10.1159/000439524"
"26316057","Neurochemical factors underlying individual differences in locomotor activity and anxiety-like behavioral responses in zebrafish","Tran S, Nowicki M, Muraleetharan A, Chatterjee D, Gerlai R.","Prog Neuropsychopharmacol Biol Psychiatry. 2016 Feb 4;65:25-33. doi: 10.1016/j.pnpbp.2015.08.009. Epub 2015 Aug 24.","Tran S","Prog Neuropsychopharmacol Biol Psychiatry","2016","2015/08/29","","","10.1016/j.pnpbp.2015.08.009"
"26031210","The effects of antidepressants appear to be rapid and at environmentally relevant concentrations","Ford AT, Fong PP.","Environ Toxicol Chem. 2016 Apr;35(4):794-8. doi: 10.1002/etc.3087. Epub 2015 Sep 23.","Ford AT","Environ Toxicol Chem","2016","2015/06/03","","","10.1002/etc.3087"
"28013489","RSK2 and its binding partners in cell proliferation, transformation and cancer development","Cho YY.","Arch Pharm Res. 2017 Mar;40(3):291-303. doi: 10.1007/s12272-016-0880-z. Epub 2016 Dec 24.","Cho YY","Arch Pharm Res","2017","2016/12/26","","","10.1007/s12272-016-0880-z"
"27821772","Emulating proton-induced conformational changes in the vesicular monoamine transporter VMAT2 by mutagenesis","Yaffe D, Vergara-Jaque A, Forrest LR, Schuldiner S.","Proc Natl Acad Sci U S A. 2016 Nov 22;113(47):E7390-E7398. doi: 10.1073/pnas.1605162113. Epub 2016 Nov 7.","Yaffe D","Proc Natl Acad Sci U S A","2016","2016/11/09","PMC5127352","","10.1073/pnas.1605162113"
"27688656","Gastrointestinal disorders associated with migraine: A comprehensive review","Cámara-Lemarroy CR, Rodriguez-Gutierrez R, Monreal-Robles R, Marfil-Rivera A.","World J Gastroenterol. 2016 Sep 28;22(36):8149-60. doi: 10.3748/wjg.v22.i36.8149.","Cámara-Lemarroy CR","World J Gastroenterol","2016","2016/10/01","PMC5037083","","10.3748/wjg.v22.i36.8149"
"27671198","BMP signaling modulates the probability of neurotransmitter release and readily releasable pools in Drosophila neuromuscular junction synapses","Lee SH, Kim YJ, Choi SY.","Biochem Biophys Res Commun. 2016 Oct 21;479(3):440-446. doi: 10.1016/j.bbrc.2016.09.072. Epub 2016 Sep 23.","Lee SH","Biochem Biophys Res Commun","2016","2016/09/28","","","10.1016/j.bbrc.2016.09.072"
"27615130","Role of long non-coding RNAs in the determination of β-cell identity","Motterle A, Sanchez-Parra C, Regazzi R.","Diabetes Obes Metab. 2016 Sep;18 Suppl 1:41-50. doi: 10.1111/dom.12714.","Motterle A","Diabetes Obes Metab","2016","2016/09/13","","","10.1111/dom.12714"
"27603392","Increased GABA concentrations in type 2 diabetes mellitus are related to lower cognitive functioning","van Bussel FC, Backes WH, Hofman PA, Puts NA, Edden RA, van Boxtel MP, Schram MT, Stehouwer CD, Wildberger JE, Jansen JF.","Medicine (Baltimore). 2016 Sep;95(36):e4803. doi: 10.1097/MD.0000000000004803.","van Bussel FC","Medicine (Baltimore)","2016","2016/09/08","PMC5023915","","10.1097/MD.0000000000004803"
"27593375","High-Probability Neurotransmitter Release Sites Represent an Energy-Efficient Design","Lu Z, Chouhan AK, Borycz JA, Lu Z, Rossano AJ, Brain KL, Zhou Y, Meinertzhagen IA, Macleod GT.","Curr Biol. 2016 Oct 10;26(19):2562-2571. doi: 10.1016/j.cub.2016.07.032. Epub 2016 Sep 1.","Lu Z","Curr Biol","2016","2016/09/06","PMC5253075","NIHMS803890","10.1016/j.cub.2016.07.032"
"27580498","Neurochemical profile of the human cervical spinal cord determined by MRS","Hock A, Wilm B, Zandomeneghi G, Ampanozi G, Franckenberg S, Zoelch N, Wyss PO, De Zanche N, Nordmeyer-Maßner J, Kraemer T, Thali M, Ernst M, Kollias S, Henning A.","NMR Biomed. 2016 Oct;29(10):1464-76. doi: 10.1002/nbm.3589. Epub 2016 Aug 31.","Hock A","NMR Biomed","2016","2016/09/01","","","10.1002/nbm.3589"
"27524670","Neurological mechanism of Xiaochaihutang's antidepressant-like effects to socially isolated adult rats","Ma J, Wu CF, Wang F, Yang JY, Dong YX, Su GY, Zhang K, Wang ZQ, Xu LW, Pan X, Zhou TS, Ma P, Song SJ.","J Pharm Pharmacol. 2016 Oct;68(10):1340-9. doi: 10.1111/jphp.12616. Epub 2016 Aug 14.","Ma J","J Pharm Pharmacol","2016","2016/08/16","","","10.1111/jphp.12616"
"27492157","Blended learning: how can we optimise undergraduate student engagement?","Morton CE, Saleh SN, Smith SF, Hemani A, Ameen A, Bennie TD, Toro-Troconis M.","BMC Med Educ. 2016 Aug 4;16:195. doi: 10.1186/s12909-016-0716-z.","Morton CE","BMC Med Educ","2016","2016/08/06","PMC4973547","","10.1186/s12909-016-0716-z"
"27468814","Cardioregulatory Functions of Neuropeptides and Peptide Hormones in Insects","Chowański S, Lubawy J, Urbański A, Rosiński G.","Protein Pept Lett. 2016;23(10):913-931. doi: 10.2174/0929866523666160728102842.","Chowański S","Protein Pept Lett","2016","2016/07/30","","","10.2174/0929866523666160728102842"
"27457561","Repeatability of gradient ultrahigh pressure liquid chromatography-tandem mass spectrometry methods in instrument-controlled thermal environments","Grinias JP, Wong JM, Kennedy RT.","J Chromatogr A. 2016 Aug 26;1461:42-50. doi: 10.1016/j.chroma.2016.07.043. Epub 2016 Jul 18.","Grinias JP","J Chromatogr A","2016","2016/07/27","PMC4981509","NIHMS804433","10.1016/j.chroma.2016.07.043"
"27358471","The orphan pentameric ligand-gated ion channel pHCl-2 is gated by pH and regulates fluid secretion in Drosophila Malpighian tubules","Feingold D, Starc T, O'Donnell MJ, Nilson L, Dent JA.","J Exp Biol. 2016 Sep 1;219(Pt 17):2629-38. doi: 10.1242/jeb.141069. Epub 2016 Jun 29.","Feingold D","J Exp Biol","2016","2016/07/01","","","10.1242/jeb.141069"
"27295966","Sulfonated nanoparticles doped electrospun fibers with bioinspired polynorepinephrine sheath for in vivo solid-phase microextraction of pharmaceuticals in fish and vegetable","Qiu J, Chen G, Zhu F, Ouyang G.","J Chromatogr A. 2016 Jul 15;1455:20-27. doi: 10.1016/j.chroma.2016.05.082. Epub 2016 May 31.","Qiu J","J Chromatogr A","2016","2016/06/15","","","10.1016/j.chroma.2016.05.082"
"27251482","[Surgery without anatomy?]","Stelzner F.","Chirurg. 2016 Aug;87(8):683-7. doi: 10.1007/s00104-016-0199-9.","Stelzner F","Chirurg","2016","2016/06/03","","","10.1007/s00104-016-0199-9"
"27249952","The circadian rhythm induced by the heterogeneous network structure of the suprachiasmatic nucleus","Gu C, Yang H.","Chaos. 2016 May;26(5):053112. doi: 10.1063/1.4949012.","Gu C","Chaos","2016","2016/06/03","","","10.1063/1.4949012"
"27234819","Transcriptome Sequencing and Comparative Analysis of Ovary and Testis Identifies Potential Key Sex-Related Genes and Pathways in Scallop Patinopecten yessoensis","Li Y, Zhang L, Sun Y, Ma X, Wang J, Li R, Zhang M, Wang S, Hu X, Bao Z.","Mar Biotechnol (NY). 2016 Aug;18(4):453-65. doi: 10.1007/s10126-016-9706-8. Epub 2016 May 27.","Li Y","Mar Biotechnol (NY)","2016","2016/05/29","","","10.1007/s10126-016-9706-8"
"27222085","[The essence of essential tremor: neurochemical bases]","Gironell A, Marin-Lahoz J.","Rev Neurol. 2016 Jun 1;62(11):507-15.","Gironell A","Rev Neurol","2016","2016/05/26","","",""
"27019621","CPT-cGMP Is A New Ligand of Epithelial Sodium Channels","Ji HL, Nie HG, Chang Y, Lian Q, Liu SL.","Int J Biol Sci. 2016 Jan 28;12(4):359-66. doi: 10.7150/ijbs.13764. eCollection 2016.","Ji HL","Int J Biol Sci","2016","2016/03/29","PMC4807156","","10.7150/ijbs.13764"
"26938800","Freud's ""Project"": The Mind-Brain Connection Revisited","Glucksman ML.","Psychodyn Psychiatry. 2016 Mar;44(1):69-90. doi: 10.1521/pdps.2016.44.1.69.","Glucksman ML","Psychodyn Psychiatry","2016","2016/03/04","","","10.1521/pdps.2016.44.1.69"
"26879866","Cholinergic activation of neurons in the medulla oblongata changes urinary bladder activity by plasma vasopressin release in female rats","Cafarchio EM, da Silva LA, Auresco LC, Ogihara CA, Almeida RL, Giannocco G, Luz MC, Fonseca FL, Sato MA.","Eur J Pharmacol. 2016 Apr 5;776:116-23. doi: 10.1016/j.ejphar.2016.02.043. Epub 2016 Feb 13.","Cafarchio EM","Eur J Pharmacol","2016","2016/02/17","","","10.1016/j.ejphar.2016.02.043"
"26868456","Toxicity mechanisms of arsenic that are shared with neurodegenerative diseases and cognitive impairment: Role of oxidative stress and inflammatory responses","Escudero-Lourdes C.","Neurotoxicology. 2016 Mar;53:223-235. doi: 10.1016/j.neuro.2016.02.002. Epub 2016 Feb 8.","Escudero-Lourdes C","Neurotoxicology","2016","2016/02/13","","","10.1016/j.neuro.2016.02.002"
"26801827","Modulatory effects of dopamine receptors on associative learning performance in zebrafish (Danio rerio)","Naderi M, Jamwal A, Chivers DP, Niyogi S.","Behav Brain Res. 2016 Apr 15;303:109-19. doi: 10.1016/j.bbr.2016.01.034. Epub 2016 Jan 20.","Naderi M","Behav Brain Res","2016","2016/01/24","","","10.1016/j.bbr.2016.01.034"
"26650254","Neurochemical substrates of the rewarding effects of MDMA: implications for the development of pharmacotherapies to MDMA dependence","Roger-Sánchez C, García-Pardo MP, Rodríguez-Arias M, Miñarro J, Aguilar MA.","Behav Pharmacol. 2016 Apr;27(2-3 Spec Issue):116-32. doi: 10.1097/FBP.0000000000000210.","Roger-Sánchez C","Behav Pharmacol","2016","2015/12/10","","","10.1097/FBP.0000000000000210"
"26558752","Improving treatment of neurodevelopmental disorders: recommendations based on preclinical studies","Homberg JR, Kyzar EJ, Stewart AM, Nguyen M, Poudel MK, Echevarria DJ, Collier AD, Gaikwad S, Klimenko VM, Norton W, Pittman J, Nakamura S, Koshiba M, Yamanouchi H, Apryatin SA, Scattoni ML, Diamond DM, Ullmann JF, Parker MO, Brown RE, Song C, Kalueff AV.","Expert Opin Drug Discov. 2016;11(1):11-25. doi: 10.1517/17460441.2016.1115834. Epub 2015 Dec 2.","Homberg JR","Expert Opin Drug Discov","2016","2015/11/13","","","10.1517/17460441.2016.1115834"
"26454332","Serotonergic medication enhances the association between suicide and sunshine","Makris GD, Reutfors J, Larsson R, Isacsson G, Ösby U, Ekbom A, Ekselius L, Papadopoulos FC.","J Affect Disord. 2016 Jan 1;189:276-81. doi: 10.1016/j.jad.2015.09.056. Epub 2015 Oct 8.","Makris GD","J Affect Disord","2016","2015/10/12","","","10.1016/j.jad.2015.09.056"
"26043757","Molecular perception of interactions between bis(7)tacrine and cystamine-tacrine dimer with cholinesterases as the promising proposed agents for the treatment of Alzheimer's disease","Eslami M, Hashemianzadeh SM, Bagherzadeh K, Seyed Sajadi SA.","J Biomol Struct Dyn. 2016;34(4):855-69. doi: 10.1080/07391102.2015.1057526. Epub 2015 Jul 8.","Eslami M","J Biomol Struct Dyn","2016","2015/06/06","","","10.1080/07391102.2015.1057526"
"25421208","Methionine Exposure Alters Glutamate Uptake and Adenine Nucleotide Hydrolysis in the Zebrafish Brain","Vuaden FC, Savio LEB, Rico EP, Mussulini BHM, Rosemberg DB, de Oliveira DL, Bogo MR, Bonan CD, Wyse ATS.","Mol Neurobiol. 2016 Jan;53(1):200-209. doi: 10.1007/s12035-014-8983-3. Epub 2014 Nov 25.","Vuaden FC","Mol Neurobiol","2016","2014/11/26","","","10.1007/s12035-014-8983-3"
"28111102","Metabolomic profiling of brain tissues of mice chronically exposed to heroin","Li RS, Takeda T, Ohshima T, Yamada H, Ishii Y.","Drug Metab Pharmacokinet. 2017 Feb;32(1):108-111. doi: 10.1016/j.dmpk.2016.10.410. Epub 2016 Oct 27.","Li RS","Drug Metab Pharmacokinet","2017","2017/01/24","","","10.1016/j.dmpk.2016.10.410"
"28018169","High Transmembrane Voltage Raised by Close Contact Initiates Fusion Pore","Bu B, Tian Z, Li D, Ji B.","Front Mol Neurosci. 2016 Dec 9;9:136. doi: 10.3389/fnmol.2016.00136. eCollection 2016.","Bu B","Front Mol Neurosci","2016","2016/12/27","PMC5145871","","10.3389/fnmol.2016.00136"
"27994947","Recent advances in the understanding of how neuropeptide Y and α-melanocyte stimulating hormone function in adipose physiology","Shipp SL, Cline MA, Gilbert ER.","Adipocyte. 2016 Jul 13;5(4):333-350. doi: 10.1080/21623945.2016.1208867. eCollection 2016 Oct-Dec.","Shipp SL","Adipocyte","2016","2016/12/21","PMC5160404","","10.1080/21623945.2016.1208867"
"27870896","M30 Antagonizes Indoleamine 2,3-Dioxygenase Activation and Neurodegeneration Induced by Corticosterone in the Hippocampus","Lam CS, Tipoe GL, Wong JK, Youdim MB, Fung ML.","PLoS One. 2016 Nov 21;11(11):e0166966. doi: 10.1371/journal.pone.0166966. eCollection 2016.","Lam CS","PLoS One","2016","2016/11/22","PMC5117770","","10.1371/journal.pone.0166966"
"27768692","Genetic Dissection of Aversive Associative Olfactory Learning and Memory in Drosophila Larvae","Widmann A, Artinger M, Biesinger L, Boepple K, Peters C, Schlechter J, Selcho M, Thum AS.","PLoS Genet. 2016 Oct 21;12(10):e1006378. doi: 10.1371/journal.pgen.1006378. eCollection 2016 Oct.","Widmann A","PLoS Genet","2016","2016/10/22","PMC5074598","","10.1371/journal.pgen.1006378"
"27753128","Participation of the dentate-rubral pathway in the kindling model of epilepsy","Hernández-Cerón M, Martínez-Lazcano JC, Rubio C, Custodio V, González-Guevara E, Castillo-Pérez C, Paz C.","J Neurosci Res. 2017 Jul;95(7):1495-1502. doi: 10.1002/jnr.23974. Epub 2016 Oct 18.","Hernández-Cerón M","J Neurosci Res","2017","2016/10/19","","","10.1002/jnr.23974"
"27734824","[Cannabinoid and cathinone designer drugs - the workings and selected methods of analysis]","Nędza J, Polaniak R, Bułdak RJ, Majchrzak M, Margasiń-Ska J, Rojkiewicz M, Celiński R, Grochowska-Niedworok E.","Pol Merkur Lekarski. 2016 Jul 29;41(241):56-59.","Nędza J","Pol Merkur Lekarski","2016","2016/10/14","","",""
"27555817","Role of VEGF, Nitric Oxide, and Sympathetic Neurotransmitters in the Pathogenesis of Tendinopathy: A Review of the Current Evidences","Vasta S, Di Martino A, Zampogna B, Torre G, Papalia R, Denaro V.","Front Aging Neurosci. 2016 Aug 9;8:186. doi: 10.3389/fnagi.2016.00186. eCollection 2016.","Vasta S","Front Aging Neurosci","2016","2016/08/25","PMC4977280","","10.3389/fnagi.2016.00186"
"27466134","Repetition priming of motor activity mediated by a central pattern generator: the importance of extrinsic vs. intrinsic program initiators","Siniscalchi MJ, Cropper EC, Jing J, Weiss KR.","J Neurophysiol. 2016 Oct 1;116(4):1821-1830. doi: 10.1152/jn.00365.2016. Epub 2016 Jul 27.","Siniscalchi MJ","J Neurophysiol","2016","2016/07/29","PMC5144695","","10.1152/jn.00365.2016"
"27426259","Inhibitory Effects of Botulinum Toxin Type A on Pyloric Cholinergic Muscle Contractility of Rat","Zhao P, Sun HX, Chu M, Hou YP.","Chin J Physiol. 2016 Aug 31;59(4):218-24. doi: 10.4077/CJP.2016.BAE401.","Zhao P","Chin J Physiol","2016","2016/07/19","","","10.4077/CJP.2016.BAE401"
"27315450","Puzzling out presynaptic differentiation","Pinto MJ, Almeida RD.","J Neurochem. 2016 Dec;139(6):921-942. doi: 10.1111/jnc.13702. Epub 2016 Jul 28.","Pinto MJ","J Neurochem","2016","2016/06/18","","","10.1111/jnc.13702"
"27260628","The comparative effects of aminoglycoside antibiotics and muscle relaxants on electrical field stimulation response in rat bladder smooth muscle","Min CH, Min YS, Lee SJ, Sohn UD.","Arch Pharm Res. 2016 Jun;39(6):863-70. doi: 10.1007/s12272-016-0765-1. Epub 2016 Jun 3.","Min CH","Arch Pharm Res","2016","2016/06/05","","","10.1007/s12272-016-0765-1"
"27208833","Disruption of the HPA-axis through corticosterone-release pellets induces robust depressive-like behavior and reduced BDNF levels in mice","Demuyser T, Bentea E, Deneyer L, Albertini G, Massie A, Smolders I.","Neurosci Lett. 2016 Jul 28;626:119-25. doi: 10.1016/j.neulet.2016.05.026. Epub 2016 May 18.","Demuyser T","Neurosci Lett","2016","2016/05/22","","","10.1016/j.neulet.2016.05.026"
"27146427","Central fatigue in multiple sclerosis: a review of the literature","Newland P, Starkweather A, Sorenson M.","J Spinal Cord Med. 2016 Jul;39(4):386-99. doi: 10.1080/10790268.2016.1168587. Epub 2016 May 5.","Newland P","J Spinal Cord Med","2016","2016/05/06","PMC5102292","","10.1080/10790268.2016.1168587"
"27117097","[Aspartate aminotransferase--key enzyme in the human systemic metabolism]","Otto-Ślusarczyk D, Graboń W, Mielczarek-Puta M.","Postepy Hig Med Dosw (Online). 2016 Mar 16;70:219-30. doi: 10.5604/17322693.1197373.","Otto-Ślusarczyk D","Postepy Hig Med Dosw (Online)","2016","2016/04/28","","","10.5604/17322693.1197373"
"27092054","Segregation of Acetylcholine and GABA in the Rat Superior Cervical Ganglia: Functional Correlation","Elinos D, Rodríguez R, Martínez LA, Zetina ME, Cifuentes F, Morales MA.","Front Cell Neurosci. 2016 Apr 7;10:91. doi: 10.3389/fncel.2016.00091. eCollection 2016.","Elinos D","Front Cell Neurosci","2016","2016/04/20","PMC4823314","","10.3389/fncel.2016.00091"
"26988891","Blood biomarkers in the early stage of cerebral ischemia","Maestrini I, Ducroquet A, Moulin S, Leys D, Cordonnier C, Bordet R.","Rev Neurol (Paris). 2016 Mar;172(3):198-219. doi: 10.1016/j.neurol.2016.02.003. Epub 2016 Mar 14.","Maestrini I","Rev Neurol (Paris)","2016","2016/03/19","","","10.1016/j.neurol.2016.02.003"
"26924680","Common Variation in the DOPA Decarboxylase (DDC) Gene and Human Striatal DDC Activity In Vivo","Eisenberg DP, Kohn PD, Hegarty CE, Ianni AM, Kolachana B, Gregory MD, Masdeu JC, Berman KF.","Neuropsychopharmacology. 2016 Aug;41(9):2303-8. doi: 10.1038/npp.2016.31. Epub 2016 Feb 29.","Eisenberg DP","Neuropsychopharmacology","2016","2016/03/01","PMC4946061","","10.1038/npp.2016.31"
"26920009","Modulation of Chronic Pain by Metabotropic Glutamate Receptors","Chiechio S.","Adv Pharmacol. 2016;75:63-89. doi: 10.1016/bs.apha.2015.11.001. Epub 2016 Jan 6.","Chiechio S","Adv Pharmacol","2016","2016/02/28","","","10.1016/bs.apha.2015.11.001"
"26902281","Duloxetine Add-On to Risperidone for Treatment of Negative Symptoms in Patients with Stable Schizophrenia: Randomized Double-Blind Placebo-Controlled Study","Nikbakhat MR, Arabzadeh S, Zeinoddini A, Khalili Z, Rezaei F, Mohammadinejad P, Ghaleiha A, Akhondzadeh S.","Pharmacopsychiatry. 2016 Jul;49(4):162-9. doi: 10.1055/s-0042-101557. Epub 2016 Feb 22.","Nikbakhat MR","Pharmacopsychiatry","2016","2016/02/24","","","10.1055/s-0042-101557"
"29931869","[Effect of dexmedetomidine on the changes of EAA and the expression of NMDA NR1 protein in hippocampus in global cerebral ischemia/reperfusion rats]","Shang Y, Xue Q, Gu PF, Li Y, Gao GJ.","Zhongguo Ying Yong Sheng Li Xue Za Zhi. 2016 Feb 8;32(2):158-162. doi: 10.13459/j.cnki.cjap.2016.02.016.","Shang Y","Zhongguo Ying Yong Sheng Li Xue Za Zhi","2016","2018/06/23","","","10.13459/j.cnki.cjap.2016.02.016"
"26792524","Subunit stoichiometry and arrangement in a heteromeric glutamate-gated chloride channel","Degani-Katzav N, Gortler R, Gorodetzki L, Paas Y.","Proc Natl Acad Sci U S A. 2016 Feb 2;113(5):E644-53. doi: 10.1073/pnas.1423753113. Epub 2016 Jan 20.","Degani-Katzav N","Proc Natl Acad Sci U S A","2016","2016/01/22","PMC4747773","","10.1073/pnas.1423753113"
"26791481","Vagotomy and Gastric Tumorigenesis","Rabben HL, Zhao CM, Hayakawa Y, Wang TC, Chen D.","Curr Neuropharmacol. 2016;14(8):967-972. doi: 10.2174/1570159x14666160121114854.","Rabben HL","Curr Neuropharmacol","2016","2016/01/22","PMC5333586","","10.2174/1570159x14666160121114854"
"26783017","Comparison of synganglion neuropeptides, neuropeptide receptors and neurotransmitter receptors and their gene expression in response to feeding in Ixodes scapularis (Ixodidae) vs. Ornithodoros turicata (Argasidae)","Egekwu N, Sonenshine DE, Garman H, Barshis DJ, Cox N, Bissinger BW, Zhu J, M Roe R.","Insect Mol Biol. 2016 Feb;25(1):72-92. doi: 10.1111/imb.12202.","Egekwu N","Insect Mol Biol","2016","2016/01/20","","","10.1111/imb.12202"
